{
  "$schema": "http://json-schema.org/draft-07/schema#",
  "title": "Token Snapshot Schema",
  "description": "Versioned snapshot of all design tokens for contract testing",
  "type": "object",
  "required": ["version", "generatedAt", "tokens"],
  "properties": {
    "version": {
      "type": "string",
      "pattern": "^\\d+\\.\\d+\\.\\d+$",
      "description": "SemVer version of the token snapshot"
    },
    "generatedAt": {
      "type": "string",
      "format": "date-time",
      "description": "ISO 8601 timestamp of generation"
    },
    "tokens": {
      "type": "object",
      "description": "All design tokens organized by category"
    },
    "primitives": {
      "type": "object",
      "description": "Primitive contracts and states"
    },
    "metadata": {
      "type": "object",
      "properties": {
        "totalTokens": { "type": "number" },
        "categories": { "type": "number" },
        "primitives": { "type": "number" },
        "changedFrom": { "type": "string" }
      }
    }
  }
}
