{
  "$schema": "./token-snapshot.schema.json",
  "version": "0.2.0",
  "generatedAt": "2025-10-22T06:45:00.000Z",
  "tokens": {
    "typography": {
      "size": {
        "xs": "12px",
        "sm": "14px",
        "md": "16px",
        "lg": "18px",
        "xl": "20px"
      },
      "weight": {
        "normal": 400,
        "medium": 500,
        "semibold": 600,
        "bold": 700
      }
    },
    "spacing": {
      "form": {
        "labelGap": "6px",
        "helperGap": "6px",
        "fieldGap": "20px",
        "sectionGap": "24px",
        "sectionBreak": "32px",
        "groupGap": "40px"
      },
      "component": {
        "xs": "4px",
        "sm": "8px",
        "md": "12px",
        "lg": "16px",
        "xl": "24px",
        "2xl": "32px"
      }
    },
    "radius": {
      "none": "0px",
      "xs": "2px",
      "sm": "4px",
      "md": "6px",
      "lg": "8px",
      "xl": "12px",
      "2xl": "16px",
      "full": "9999px"
    },
    "interactive": {
      "minHeight": {
        "mobile": "48px",
        "desktop": "40px",
        "compact": "32px"
      },
      "minWidth": {
        "touch": "44px",
        "button": "88px"
      },
      "iconSize": {
        "xs": "12px",
        "sm": "16px",
        "md": "20px",
        "lg": "24px",
        "xl": "32px"
      },
      "focusRing": {
        "width": "3px",
        "offset": "0px",
        "color": "rgb(59, 130, 246)"
      }
    },
    "colors": {
      "semantic": {
        "success": "rgb(22, 163, 74)",
        "successBg": "rgb(220, 252, 231)",
        "successBorder": "rgb(134, 239, 172)",
        "warning": "rgb(234, 179, 8)",
        "warningBg": "rgb(254, 249, 195)",
        "warningBorder": "rgb(253, 224, 71)",
        "error": "rgb(220, 38, 38)",
        "errorBg": "rgb(254, 242, 242)",
        "errorBorder": "rgb(252, 165, 165)",
        "info": "rgb(37, 99, 235)",
        "infoBg": "rgb(219, 234, 254)",
        "infoBorder": "rgb(147, 197, 253)"
      },
      "neutral": {
        "text": "rgb(17, 24, 39)",
        "textMuted": "rgb(107, 114, 128)",
        "textDisabled": "rgb(156, 163, 175)",
        "textPlaceholder": "rgb(156, 163, 175)",
        "border": "rgb(209, 213, 219)",
        "borderHover": "rgb(156, 163, 175)",
        "borderFocus": "rgb(59, 130, 246)",
        "bg": "rgb(255, 255, 255)",
        "bgHover": "rgb(249, 250, 251)",
        "bgDisabled": "rgb(249, 250, 251)",
        "bgSubtle": "rgb(243, 244, 246)"
      },
      "interactive": {
        "primary": "rgb(37, 99, 235)",
        "primaryHover": "rgb(29, 78, 216)",
        "primaryActive": "rgb(30, 64, 175)",
        "primaryBg": "rgb(219, 234, 254)",
        "secondary": "rgb(75, 85, 99)",
        "secondaryHover": "rgb(55, 65, 81)",
        "secondaryActive": "rgb(31, 41, 55)",
        "secondaryBg": "rgb(249, 250, 251)",
        "danger": "rgb(220, 38, 38)",
        "dangerHover": "rgb(185, 28, 28)",
        "dangerActive": "rgb(153, 27, 28)",
        "dangerBg": "rgb(254, 242, 242)",
        "success": "rgb(22, 163, 74)",
        "successHover": "rgb(21, 128, 61)",
        "successActive": "rgb(22, 101, 52)",
        "successBg": "rgb(220, 252, 231)",
        "warning": "rgb(234, 179, 8)",
        "warningHover": "rgb(202, 138, 4)",
        "warningActive": "rgb(161, 98, 7)",
        "warningBg": "rgb(254, 249, 195)",
        "link": "rgb(37, 99, 235)",
        "linkHover": "rgb(29, 78, 216)",
        "linkActive": "rgb(30, 64, 175)",
        "focus": "rgb(59, 130, 246)",
        "focusRing": "rgba(59, 130, 246, 0.1)"
      }
    },
    "shadows": {
      "none": "none",
      "hover": {
        "subtle": "0 1px 2px 0 rgba(0, 0, 0, 0.12), 0 4px 8px -2px rgba(0, 0, 0, 0.08)",
        "medium": "0 2px 4px 0 rgba(0, 0, 0, 0.16), 0 8px 16px -4px rgba(0, 0, 0, 0.12)",
        "strong": "0 4px 6px 0 rgba(0, 0, 0, 0.20), 0 12px 24px -6px rgba(0, 0, 0, 0.16)"
      },
      "active": {
        "subtle": "0 1px 1px 0 rgba(0, 0, 0, 0.10), 0 2px 4px -1px rgba(0, 0, 0, 0.06)",
        "medium": "0 1px 2px 0 rgba(0, 0, 0, 0.12), 0 4px 8px -2px rgba(0, 0, 0, 0.08)"
      },
      "focus": "0 0 0 3px rgba(59, 130, 246, 0.15)",
      "focusError": "0 0 0 3px rgba(220, 38, 38, 0.15)",
      "inner": "inset 0 2px 4px 0 rgba(0, 0, 0, 0.06)"
    },
    "transitions": {
      "duration": {
        "instant": "0ms",
        "fast": "150ms",
        "normal": "200ms",
        "slow": "300ms",
        "slower": "500ms"
      },
      "easing": {
        "linear": "linear",
        "easeIn": "cubic-bezier(0.4, 0, 1, 1)",
        "easeOut": "cubic-bezier(0, 0, 0.2, 1)",
        "easeInOut": "cubic-bezier(0.4, 0, 0.2, 1)",
        "spring": "cubic-bezier(0.68, -0.55, 0.265, 1.55)"
      },
      "common": {
        "all": "all 200ms cubic-bezier(0.4, 0, 0.2, 1)",
        "colors": "background-color 150ms ease-in-out, border-color 150ms ease-in-out, color 150ms ease-in-out",
        "opacity": "opacity 200ms ease-in-out",
        "transform": "transform 200ms cubic-bezier(0.4, 0, 0.2, 1)",
        "shadow": "box-shadow 150ms ease-in-out"
      }
    },
    "glassmorphism": {
      "blur": {
        "none": "0px",
        "xs": "4px",
        "sm": "8px",
        "md": "12px",
        "lg": "16px",
        "xl": "24px"
      },
      "opacity": {
        "light": 0.7,
        "medium": 0.8,
        "heavy": 0.9,
        "solid": 1.0
      }
    }
  },
  "primitives": {
    "ds-input": {
      "states": ["default", "hover", "focus", "disabled", "error"],
      "contracts": {
        "minHeight": "48px",
        "borderRadius": "6px",
        "focusRing": "3px",
        "contrastRatio": 4.5
      }
    },
    "ds-button": {
      "variants": ["primary", "secondary", "ghost", "danger", "success", "warning", "link"],
      "states": ["default", "hover", "active", "focus", "disabled"],
      "contracts": {
        "minHeight": "48px",
        "minWidth": "88px",
        "borderRadius": "8px",
        "contrastRatio": 4.5,
        "hoverElevation": "translateY(-1px)",
        "activeElevation": "translateY(0px)"
      }
    }
  },
  "metadata": {
    "totalTokens": 133,
    "categories": 8,
    "primitives": 2,
    "changedFrom": "v0.1.0"
  }
}
